number,segment,content,option_a,option_b,option_c,option_d,option_e,score_a,score_b,score_c,score_d,score_e,discussion,sub_category
102,TKP,"Beban kerja di unit Anda sedang sangat tinggi. Anda memiliki tiga tugas penting: A (Sangat urgen, dampak besar), B (Kurang urgen, tugas rutin), C (Urgen, instruksi langsung atasan terkait rapat hari ini). Strategi penyelesaian Anda...",Mengerjakan tugas yang paling mudah (B) terlebih dahulu agar terlihat ada progres,Mengerjakan semuanya secara bersamaan (*multitasking*) meskipun hasilnya berantakan,"Menyusun skala prioritas: Mengerjakan C (rapat hari ini) dan A secara berurutan, lalu menyelesaikan B jika ada waktu tersisa atau mendelegasikan B jika memungkinkan",Menunda semua tugas karena merasa tertekan (stres),Meminta cuti sakit untuk menghindari tumpukan pekerjaan,4,3,5,2,1,Profesionalisme. Manajemen waktu dan prioritas (*Eisenhower Matrix*). Mengutamakan tugas urgen yang berdampak langsung (C dan A) menunjukkan efisiensi kerja yang terarah.,Profesionalisme
103,TKP,"Pimpinan instansi sedang dinas ke luar negeri. Tiba-tiba terjadi masalah operasional yang membutuhkan keputusan cepat. Sesuai SOP, hanya pimpinan yang berhak memutuskan. Langkah Anda...",Mengambil keputusan sendiri secara sepihak meskipun melanggar SOP,Membiarkan masalah tersebut berlarut-larut sampai pimpinan pulang,"Mencoba menghubungi pimpinan melalui telepon/email darurat. Jika benar-benar tidak bisa dihubungi, Anda berkonsultasi dengan wakil pimpinan atau mengambil langkah mitigasi awal yang paling aman sesuai SOP",Menyuruh instansi lain yang menangani masalah tersebut,Meliburkan operasional kantor pada hari itu,4,3,5,2,1,"Profesionalisme. Keberanian mengambil risiko yang terukur (*calculated risk*). Menghubungi pimpinan terlebih dahulu, lalu mengambil langkah mitigasi darurat sesuai batas kewenangan jika mendesak.",Profesionalisme
104,TKP,Kantor menugaskan Anda mengikuti bimbingan teknis (Bimtek) selama 3 hari. Ternyata materi Bimtek tersebut sangat membosankan dan Anda merasa sudah menguasainya. Sikap Anda selama acara...,Sering bolos di jam materi untuk berjalan-jalan di *mall* sekitar hotel,Duduk di barisan paling belakang dan bermain *game* di ponsel seharian,"Tetap mengikuti Bimtek dengan disiplin, menghargai pemateri, dan mencoba berjejaring (networking) dengan peserta dari instansi lain untuk bertukar informasi",Memprotes panitia secara terbuka agar materi segera diakhiri,Tidur di dalam ruang kelas karena merasa bosan,4,3,5,2,1,"Profesionalisme. Penugasan dinas (Bimtek) adalah amanat negara. ASN harus menjunjung tinggi disiplin dan etika pembelajaran, serta memaksimalkan nilai tambah kegiatan (berjejaring).",Profesionalisme
105,TKP,"Anda sedang mengalami gejala flu ringan, namun pekerjaan di kantor sedang sangat menumpuk dan membutuhkan kehadiran Anda. Sikap Anda...",Mengambil cuti sakit berhari-hari dan membiarkan pekerjaan terbengkalai,Memaksa masuk kerja seperti biasa tanpa protokol kesehatan dan sering bersin di depan rekan kerja,"Masuk kerja dengan menggunakan masker, menjaga jarak, segera menyelesaikan tugas-tugas yang paling mendesak (urgen), lalu meminta izin pulang lebih awal untuk beristirahat",Menyuruh rekan kerja membelikan obat dan Anda tidur di meja kerja seharian,"Masuk kerja hanya untuk melakukan presensi (*fingerprint*), lalu diam-diam pulang ke rumah",4,3,5,2,1,Profesionalisme. Tanggung jawab terhadap pekerjaan diseimbangkan dengan kepedulian pada kesehatan diri & rekan kerja. Mitigasi tugas urgen lalu istirahat adalah kompromi profesional.,Profesionalisme
106,TKP,"Seorang tetangga mengajak Anda menghadiri kelompok kajian keagamaan eksklusif. Dalam kajian tersebut, penceramah sering memprovokasi jemaah untuk membenci pemerintah dan menolak sistem demokrasi Pancasila. Sikap Anda...",Ikut terpengaruh dan mulai membenci pemerintah,Mengangguk setuju agar tetangga Anda tidak tersinggung,"Menolak halus ajakan kajian berikutnya, membentengi keluarga dengan pemahaman agama yang moderat, dan jika provokasinya mengarah pada aksi anarkis/makar, melaporkannya ke aparat berwenang (RT/RW/Polisi)",Menantang penceramah tersebut berdebat di tengah-tengah kajian,Memusuhi tetangga Anda dan melarang warga lain berbicara dengannya,4,3,5,2,1,"Anti-radikalisme. Deteksi dini intoleransi. Membentengi diri sendiri/keluarga, menolak ikut serta, dan eskalasi laporan secara hierarkis jika ada indikasi pergerakan anti-NKRI/makar.",Anti-radikalisme
107,TKP,Anda menemukan setumpuk pamflet gelap di toilet kantor yang berisi ajakan untuk mendiskreditkan kelompok agama minoritas dan mendukung aksi intoleransi. Tindakan Anda...,Membiarkan pamflet tersebut tergeletak di sana karena bukan urusan Anda,Membaca pamflet tersebut dan membagikannya ke rekan kerja lain karena penasaran,"Segera mengumpulkan dan membuang pamflet tersebut, lalu melaporkan temuan ini kepada atasan atau petugas keamanan kantor agar kewaspadaan ditingkatkan",Menulis tanggapan di pamflet tersebut dan menempelkannya kembali ke dinding,Membahas pamflet tersebut di grup WhatsApp kantor hingga menimbulkan kepanikan,4,3,5,2,1,Anti-radikalisme. Memutus rantai penyebaran paham intoleran di lingkungan kerja. Melaporkan kepada keamanan internal (provost/satpam/atasan) mencegah instansi disusupi paham radikal.,Anti-radikalisme
108,TKP,"Anak Anda yang masih SMP bertanya mengapa ada orang yang tega melakukan bom bunuh diri atas nama agama, seperti yang ia lihat di televisi. Penjelasan Anda sebagai orang tua yang berjiwa nasionalis...",Menjelaskan bahwa tindakan tersebut adalah takdir yang harus terjadi,Menyuruh anak untuk tidak menonton berita dan fokus belajar saja,"Menjelaskan dengan bahasa yang mudah dipahami bahwa tindakan tersebut adalah kejahatan terorisme yang salah dan menyimpang dari ajaran agama mana pun, serta menanamkan nilai kasih sayang dan toleransi",Menyalahkan agama tertentu sebagai sumber kekerasan agar anak menjauhinya,Mengatakan bahwa pelaku bom bunuh diri adalah orang-orang hebat yang berani mati,4,3,5,2,1,Anti-radikalisme. Edukasi literasi moderasi beragama dimulai dari keluarga. Memberi pemahaman bahwa terorisme bertentangan dengan semua agama mencegah anak terpapar radikalisme sejak dini.,Anti-radikalisme
109,TKP,"Dalam upacara bendera Hari Kemerdekaan di kantor, Anda melihat seorang rekan kerja baru (CPNS) sengaja tidak mau hormat kepada bendera merah putih karena keyakinan pribadinya yang menganggap hal tersebut musyrik. Sikap Anda...",Memakinya sebagai pengkhianat bangsa di depan seluruh peserta upacara,Mendiamkan saja karena itu adalah hak asasi keyakinannya,"Setelah upacara, mengajaknya berdialog empat mata dengan pendekatan persuasif, memberikan edukasi bahwa hormat bendera adalah bentuk penghormatan budaya/negara (nasionalisme), bukan ritual penyembahan berhala",Melaporkannya ke polisi agar ia ditangkap dan dipenjara,Ikut-ikutan tidak hormat bendera agar ia merasa memiliki teman,4,3,5,2,1,Anti-radikalisme. Pendekatan persuasif dan edukasi (*wawasan kebangsaan*) di level *peer-to-peer*. Meluruskan doktrin yang salah kaprah (hormat bendera = syirik) dengan pemahaman historis negara tanpa harus mempermalukannya.,Anti-radikalisme
110,TKP,Grup WhatsApp warga RT Anda mendadak ramai oleh *forward* pesan (hoaks) yang memprovokasi warga untuk mengusir pendatang dari etnis tertentu karena dituduh membawa penyakit dan mengambil lapangan kerja. Situasi mulai memanas. Langkah Anda...,Keluar (*left*) dari grup WhatsApp tersebut agar tidak pusing,Ikut memanaskan suasana dengan membagikan berita serupa,"Dengan kepala dingin, Anda membagikan tautan/data klarifikasi dari sumber resmi pemerintah yang menyatakan berita itu hoaks, serta mengingatkan admin grup untuk menjaga ketertiban demi kerukunan warga",Menantang duel siapa saja yang berani mengusir pendatang,Mendatangi rumah penyebar hoaks tersebut dan memukulnya,4,3,5,2,1,"Anti-radikalisme & TIK. *Counter-narrative* (narasi tandingan) yang cepat dan valid. Sebagai ASN, Anda berperan menenangkan warga (*cooling system*) dan mencegah konflik horizontal akibat disinformasi etnosentris.",Anti-radikalisme
