number,segment,sub_category,content,image_url,option_a,option_b,option_c,option_d,option_e,score_a,score_b,score_c,score_d,score_e,discussion,option_image_a,option_image_b,option_image_c,option_image_d,option_image_e
104,TKP,Pelayanan Publik,,"Memintanya dengan sopan namun sangat tegas untuk tetap mengambil nomor antrean sesuai SOP, karena sistem antrean diawasi secara elektronik dan semua warga memiliki hak pelayanan yang setara.",Menyerahkan pelayanan orang tersebut kepada atasan Anda agar Anda tidak perlu berurusan dengan politik lokal.,Berpura-pura sistem sedang *error* sehingga Anda tidak bisa melayaninya saat itu juga.,Segera melayaninya agar Anda terhindar dari masalah dan kemarahan pejabat tersebut.,Berdebat dengannya dan menantangnya untuk membuktikan ancamannya tersebut di depan warga lain.,5,3,4,2,1,"Integritas & Pelayanan Publik. ASN dituntut adil dan tidak diskriminatif. Menolak intervensi (*nepotisme/conflict of interest*) secara sopan, asertif, dan bersandar pada aturan (SOP elektronik) adalah manifestasi *core values* BerAKHLAK.",,,,,,
105,TKP,Anti-radikalisme,,"Berkoordinasi kilat dengan ketua panitia lapangan dan aparat pendamping untuk segera menghentikan sesi narasumber tersebut dengan alasan teknis (misal: waktu habis/gangguan *sound*), lalu memberikan sesi *debriefing* pemulihan wawasan kebangsaan kepada para pelajar.","Langsung naik ke atas panggung, merebut mikrofon dari narasumber, dan membubarkan acara tersebut.",Merekam ceramah tersebut dan memviralkannya di media sosial agar narasumber tersebut ditangkap polisi.,"Membiarkan acara berlangsung hingga selesai karena menghormati narasumber pilihan panitia pusat, lalu mencatatnya di laporan akhir.",Meninggalkan lokasi perkemahan karena tidak ingin mendengarkan ceramah yang bertentangan dengan prinsip Anda.,5,1,3,2,4,"Anti-radikalisme & Profesionalisme. Melindungi generasi muda dari paparan radikalisme adalah keharusan. Menghentikan sesi secara taktis (alasan teknis) mencegah kegaduhan fisik di depan anak sekolah, diikuti langkah krusial *debriefing* (pemulihan narasi kebangsaan) agar siswa tidak bingung/terpapar.",,,,,,
106,TKP,Profesionalisme,,"Berbicara dari hati ke hati secara profesional, mengingatkan bahwa *slow response*-nya menghambat target tim, dan memintanya berkomitmen pada jam kerja instansi. Jika tidak berubah, Anda akan eskalasi ke atasan.",Mengeluarkan rekan tersebut dari grup koordinasi kerja agar ia tidak mendapatkan informasi penting.,Membiarkannya saja karena di era modern wajar jika ASN memiliki *side hustle* (pekerjaan sampingan) untuk tambahan penghasilan.,"Mengumpulkan bukti *screenshot* keterlambatannya dan media sosialnya, lalu melaporkannya secara anonim ke Inspektorat.",Meniru jejaknya dengan ikut berbisnis *online* saat giliran Anda WFH agar adil dan sama-sama untung.,5,4,2,3,1,Profesionalisme & Jejaring Kerja. WFH bukan hari libur atau waktu untuk bisnis pribadi (*conflict of interest* waktu kerja). Pendekatan asertif (*peer-to-peer correction*) adalah langkah pertama yang bijak sebelum melakukan eskalasi struktural.,,,,,,
107,TKP,Sosial Budaya,,Meminta pindah divisi ke HRD hari itu juga karena lingkungan kerja sangat *toxic* dan rasis.,"Tersenyum sopan, lalu secara santai namun asertif menyatakan bahwa lelucon tersebut membuat Anda kurang nyaman, dan perlahan mengalihkan pembicaraan ke topik pekerjaan atau hobi yang lebih netral.","Langsung berdiri, menggebrak meja, dan menuduh mereka semua sebagai kelompok rasis yang melanggar HAM.",Menghindari interaksi sosial sama sekali dan hanya berbicara dengan mereka sebatas urusan kerja formal di jam kerja.,Tertawa dan ikut mengejek etnis Anda sendiri agar Anda cepat diterima dalam pergaulan mereka (*people pleaser*).,3,5,1,4,2,Sosial Budaya & Jejaring Kerja. *Micro-aggression* sering terjadi tanpa niat jahat. Merespons dengan asertif (menyatakan ketidaknyamanan tanpa konfrontasi agresif) mengedukasi rekan kerja untuk lebih peka secara kultural sekaligus menjaga keharmonisan tim.,,,,,,
108,TKP,Pelayanan Publik,,"Mempersilakan mereka demo karena itu adalah hak demokrasi, dan Anda berlindung di dalam kantor.","Membentuk 'Posko Relawan Digital' di balai desa, berkolaborasi dengan perangkat desa dan pemuda karang taruna setempat untuk memfasilitasi *input* data massal petani lansia ke dalam sistem aplikasi secara gotong royong.",Menggunakan satu akun Anda untuk mendaftarkan semua ratusan petani tersebut secara paksa meskipun melanggar *database* kependudukan.,Menghubungi kementerian untuk menghapus sistem digital tersebut selamanya karena menyusahkan rakyat kecil.,Bersikeras bahwa mereka harus membeli *smartphone* jika ingin mendapatkan pupuk karena Anda tidak bisa melanggar aturan sistem dari pusat.,2,5,4,3,1,"Pelayanan Publik, Jejaring Kerja, & TIK. Menggabungkan solusi teknologi dengan kearifan sosial. Membentuk posko relawan melibatkan elemen masyarakat (*collaborative governance*) untuk menjembatani kesenjangan digital (*digital divide*) tanpa merusak regulasi pusat.",,,,,,
109,TKP,Profesionalisme,,"Menolak dengan halus namun tegas, menyusun nota dinas yang merinci data risiko teknis pencemaran air berserta landasan hukum pidana lingkungan hidup, dan mengusulkan opsi *redesign* sistem pembuangan limbah kepada pemrakarsa proyek.",Mengikuti perintah atasan untuk meloloskan dokumen tersebut karena tanggung jawab akhir ada di tangan pimpinan yang menandatangani.,Menyebarkan dokumen risiko lingkungan tersebut ke aktivis LSM dan wartawan lingkungan agar pabrik didemo.,Mengerjakan laporan sesuai pesanan namun Anda menolak untuk membubuhkan paraf atau inisial Anda di dokumen tersebut.,Mengundurkan diri dari tim AMDAL tersebut dengan alasan sakit berkepanjangan agar terhindar dari dosa.,5,1,2,4,3,Profesionalisme & Integritas. Etika teknokratik ASN menuntut kejujuran ilmiah dan kepatuhan hukum di atas tekanan politis/atasan (UU ASN: tidak taat pada perintah yang bertentangan dengan hukum). Memberikan analisis dampak dan menawarkan alternatif *redesign* menunjukkan sifat *problem solver* yang kompeten.,,,,,,
110,TKP,Pelayanan Publik,,"Segera melapor ke atasan dan Humas, menyerahkan rekaman CCTV utuh loket sebagai bukti autentik, lalu mendukung instansi untuk merilis video klarifikasi resmi yang profesional tanpa perlu menyerang balik warga pembuat konten tersebut.",Membalas komentar netizen satu per satu dengan akun anonim palsu untuk membela diri Anda dengan agresif.,Mencari alamat warga penyebar video tersebut dan membawa polisi untuk menangkapnya dengan pasal UU ITE tentang pencemaran nama baik.,Membuat video balasan di TikTok pribadi Anda sambil menangis meminta keadilan dari masyarakat.,"Merasa depresi, mengunci seluruh akun media sosial Anda, dan menolak pergi bekerja karena trauma.",5,1,3,4,2,"TIK, Pelayanan Publik, & Profesionalisme. Di era *cancel culture* dan viralitas, klarifikasi harus berbasis data objektif (CCTV) dan disalurkan secara institusional (via Humas), bukan reaktif personal (berbalas pantun di medsos). Menghindari sikap pendendam (tidak langsung memenjarakan) menunjukkan kematangan emosional pelayanan publik.",,,,,,
